{
  "contract": "brokoli.task-result/v1",
  "interface_digest": "sha256:6b86b273ff34fce19d6b804eff5a3f5747ada4eaa22f1d49c01e52ddb7875b4b",
  "outputs": {
    "result": {
      "kind": "dataset",
      "path": "result.arrow",
      "codec": "arrow-ipc/v1",
      "size_bytes": 48120,
      "checksum": "sha256:d4735e3a265e16eee03f59718b9b5d03019c07d8b6c51f90da3a666eec13ab35"
    }
  },
  "metadata": { "rows_scored": 500 }
}
